{
  "id": "582a16691d0ca8281d33a4b848ad7de90169b0911862ab134a36180f317e8269",
  "owner": "synthetic-intake-actor",
  "pair_id": "80e1cb18-a2dd-4920-a996-49e00b5d7e55",
  "outcome": "A",
  "rationale": "Synthetic test choice only. No human-use result is asserted.",
  "payload_json": "{\"actor\":{\"crossSystemPrincipalMapping\":null,\"siteScopedId\":\"synthetic-intake-actor\"},\"assets\":[{\"id\":\"9596cd811612c91579468065a4f239fac60ea9db49610553a42378dbecb46842\",\"lineage\":{\"parameters\":{\"brightness\":1,\"contrast\":1,\"crop\":\"original\",\"maxWidth\":1600,\"rotate\":0,\"saturation\":1},\"parentSha256\":\"b7a696712e6fef8f8282ff889047f57e569b4d3322f007661130f2ca07444fe9\",\"processor\":\"browser-canvas-v1\",\"verification\":\"client-reported recipe; server-verified byte digest\"},\"origin\":\"browser_variant\",\"parentId\":\"fd3f83026c379f41d4db4bc9f454337378efe29ccd2a06dcecdfe10d03dd255a\",\"rights\":\"operator_attested_private_use\",\"sha256\":\"d6cdc95381ad6f469e6446f9226d4e92363141b2309cd81bca0a32d54d32598e\"},{\"id\":\"fd3f83026c379f41d4db4bc9f454337378efe29ccd2a06dcecdfe10d03dd255a\",\"lineage\":{},\"origin\":\"upload\",\"parentId\":null,\"rights\":\"review_only\",\"sha256\":\"b7a696712e6fef8f8282ff889047f57e569b4d3322f007661130f2ca07444fe9\"}],\"eventId\":\"582a16691d0ca8281d33a4b848ad7de90169b0911862ab134a36180f317e8269\",\"graphProposal\":{\"autoApply\":false,\"context\":\"Synthetic contract fixture; not Bryan preference evidence\",\"criterion\":\"Which image has the more legible layout?\",\"from\":\"9596cd811612c91579468065a4f239fac60ea9db49610553a42378dbecb46842\",\"relation\":\"PREFERRED_OVER\",\"to\":\"fd3f83026c379f41d4db4bc9f454337378efe29ccd2a06dcecdfe10d03dd255a\"},\"judgment\":{\"createdAt\":\"2026-09-09T23:17:04.932Z\",\"outcome\":\"A\",\"rationale\":\"Synthetic test choice only. No human-use result is asserted.\"},\"kind\":\"HumanImageComparison\",\"limits\":{\"canonAdmission\":false,\"independentEvaluation\":false,\"modelTraining\":false,\"runtimeAuthority\":false},\"presentation\":{\"A\":{\"assetId\":\"9596cd811612c91579468065a4f239fac60ea9db49610553a42378dbecb46842\",\"sha256\":\"d6cdc95381ad6f469e6446f9226d4e92363141b2309cd81bca0a32d54d32598e\"},\"B\":{\"assetId\":\"fd3f83026c379f41d4db4bc9f454337378efe29ccd2a06dcecdfe10d03dd255a\",\"sha256\":\"b7a696712e6fef8f8282ff889047f57e569b4d3322f007661130f2ca07444fe9\"},\"context\":\"Synthetic contract fixture; not Bryan preference evidence\",\"createdAt\":\"2026-09-09T23:17:04.892Z\",\"id\":\"80e1cb18-a2dd-4920-a996-49e00b5d7e55\",\"method\":\"Randomized side assignment; operator-selected assets; not a held-out study\",\"question\":\"Which image has the more legible layout?\"},\"purpose\":\"Private image comparison and candidate preference evidence\",\"schemaVersion\":\"quirk.image-preference-candidate.v0.1\",\"sourceSite\":\"appgprj_6a895cbd193481918ad2fccdf0e0ee3f\",\"status\":\"candidate\"}",
  "payload_digest": "74aa9cfb706298486b7d068ed2749ad995dbc8f825cad3ad3531078dca06b6ed",
  "graph_state": "AWAITING_INTEGRATION",
  "created_at": "2026-09-09T23:17:04.932Z"
}
